{
  "purpose": "everyday-cashback",
  "monthlySpending": {
    "dining": 400,
    "groceries": 600,
    "gas": 200,
    "travel": 0,
    "transit": 100,
    "drugstores": 50,
    "streaming": 50,
    "onlineShopping": 300,
    "entertainment": 150,
    "homeImprovement": 0,
    "utilities": 150,
    "other": 200
  },
  "eligibility": {
    "hasExistingCard": false,
    "existingCardIds": [],
    "isStudent": false,
    "under21": false
  },
  "paymentBehavior": {
    "paysInFull": true,
    "prefersNoAnnualFee": true,
    "needsTravelBenefits": false
  },
  "filters": {
    "maxAnnualFee": 0,
    "minCreditScore": 720,
    "mustHaveNoForeignTransactionFee": false,
    "mustHaveTravelBenefits": false
  }
}

